{
  "category": "Cockatoos",
  "species": "Bare-Eyed Cockatoo",
  "slug": "bare-eyed-cockatoo",
  "image": "/assets/img/parrots/bare-eyed-cockatoo.webp",
  "description": "A medium-sized white cockatoo, also known as a Little Corella, with a distinctive bare, greyish-blue patch of skin around its eyes. They are known for their playful and comical nature.",
  "size": "14-15 inches (35.5-38 cm). Weight: 370-520g (13-18.5 oz)",
  "weight_grams": 445,
  "temperament": "Extremely playful, intelligent, and outgoing. They can be very affectionate and are known for being clowns. They are also less prone to the high-strung nature of larger cockatoos.",
  "loudness": "Loud. While maybe not as deafening as a Moluccan, they have a very loud call and enjoy using it, especially in the morning and evening.",
  "loudness_icon": "<svg xmlns=\"http://www.w3.org/2000/svg\" class=\"w-12 h-12 text-red-500\" viewBox=\"0 0 24 24\" fill=\"currentColor\" aria-hidden=\"true\" role=\"img\" aria-label=\"Loud\"><title>Loud</title><path d=\"M3 9v6h4l5 5V4L7 9H3zm13.5 3c0-1.77-1.02-3.29-2.5-4.03v8.05c1.48-.73 2.5-2.25 2.5-4.02zM14 3.23v2.06c2.89.86 5 3.54 5 6.71s-2.11 5.85-5 6.71v2.06c4.01-.91 7-4.49 7-8.77s-2.99-7.86-7-8.77z\"></path></svg>",
  "vocalization": "Can be very good talkers, with a clear ability to mimic words and phrases. They are also very vocal with a variety of squawks and calls.",
  "dietaryNeeds": "A high-quality pelleted diet should form the base. Supplement with fresh vegetables, some fruit, and limited nuts. They are prone to obesity.",
  "healthPointers": "A hardy species with a lifespan of 50+ years. Prone to PBFD and fatty liver disease if on an improper diet. Their playful nature requires a lot of enriching toys.",
  "housing": "Can be challenging for apartments due to their noise level. They need a very durable cage with a strong lock, as they are clever escape artists. Minimum size: 36\"W x 24\"D x 48\"H.",
  "origin": "Australia & Oceania"
}
